<?xml version="1.0" encoding="UTF-8"?>
<Musicshop xmlns:xsi="http://www.w3.org/2001/XMLSchema-instance"
 xsi:noNamespaceSchemaLocation="file:/C:/Users/polic/Desktop/uni/asp/MusicStore/XSD%20schema/MusicStore.xsd">
    <DVDs>
        <DVD>
            <DVD_album_name numberSongs="48">Lover</DVD_album_name>
            <DVD_artist_name autograph="false">Taylor Swift</DVD_artist_name>
            <DVD_label_name>Universal</DVD_label_name>
            <DVD_release_date>2016-05-04</DVD_release_date>
            <DVD_price>48</DVD_price>
            <DVD_image>taylor.jpg</DVD_image>
        </DVD>
        <DVD>
            <DVD_album_name numberSongs="29">Hamilton</DVD_album_name>
            <DVD_artist_name autograph="true">Various Artists</DVD_artist_name>
            <DVD_label_name>Sun</DVD_label_name>
            <DVD_release_date>2018-05-04</DVD_release_date>
            <DVD_price>59</DVD_price>
            <DVD_image>hamilton.jpg</DVD_image>
        </DVD>
    </DVDs>
    <FanMerchandise>
        <T-shirts>
            <T-shirt>
                <T_shirt_artist_name color="black">The Black Eyed Peas</T_shirt_artist_name>
                <T-shirt_price>48</T-shirt_price>
                <T-shirt_image>TBEP2324.jpg</T-shirt_image>
            </T-shirt>
        </T-shirts>
    </FanMerchandise>
</Musicshop>
