<?xml version="1.0" encoding="UTF-8"?>
<Musicshop xmlns:xsi="http://www.w3.org/2001/XMLSchema-instance"
 xsi:noNamespaceSchemaLocation="file:/C:/Users/polic/Desktop/uni/asp/MusicStore/XSD%20schema/MusicStore.xsd">
    <CDs>
        <CD>
            <CD_album_name numberSongs="0">CD_album_name0</CD_album_name>
            <CD_artist_name autograph="false">CD_artist_name0</CD_artist_name>
            <CD_label_name>CD_label_name0</CD_label_name>
            <CD_release_date>2006-05-04</CD_release_date>
            <CD_price>0</CD_price>
            <CD_image>CD_image0</CD_image>
        </CD>
        <CD>
            <CD_album_name numberSongs="0">CD_album_name1</CD_album_name>
            <CD_artist_name autograph="false">CD_artist_name1</CD_artist_name>
            <CD_label_name>CD_label_name1</CD_label_name>
            <CD_release_date>2006-05-04</CD_release_date>
            <CD_price>0</CD_price>
            <CD_image>CD_image1</CD_image>
        </CD>
    </CDs>
    <DVDs>
        <DVD>
            <DVD_album_name numberSongs="0">DVD_album_name0</DVD_album_name>
            <DVD_artist_name autograph="false">DVD_artist_name0</DVD_artist_name>
            <DVD_label_name>DVD_label_name0</DVD_label_name>
            <DVD_release_date>2006-05-04</DVD_release_date>
            <DVD_price>0</DVD_price>
            <DVD_image>DVD_image0</DVD_image>
        </DVD>
        <DVD>
            <DVD_album_name numberSongs="0">DVD_album_name1</DVD_album_name>
            <DVD_artist_name autograph="false">DVD_artist_name1</DVD_artist_name>
            <DVD_label_name>DVD_label_name1</DVD_label_name>
            <DVD_release_date>2006-05-04</DVD_release_date>
            <DVD_price>0</DVD_price>
            <DVD_image>DVD_image1</DVD_image>
        </DVD>
    </DVDs>
    <Vinyls>
        <Vinyl>
            <Vinyl_album_name numberSongs="0">Vinyl_album_name0</Vinyl_album_name>
            <Vinyl_artist_name autograph="false">Vinyl_artist_name0</Vinyl_artist_name>
            <Vinyl_label_name>Vinyl_label_name0</Vinyl_label_name>
            <Vinyl_release_date>2006-05-04</Vinyl_release_date>
            <Vinyl_price>0</Vinyl_price>
            <Vinyl_image>Vinyl_image0</Vinyl_image>
        </Vinyl>
        <Vinyl>
            <Vinyl_album_name numberSongs="0">Vinyl_album_name1</Vinyl_album_name>
            <Vinyl_artist_name autograph="false">Vinyl_artist_name1</Vinyl_artist_name>
            <Vinyl_label_name>Vinyl_label_name1</Vinyl_label_name>
            <Vinyl_release_date>2006-05-04</Vinyl_release_date>
            <Vinyl_price>0</Vinyl_price>
            <Vinyl_image>Vinyl_image1</Vinyl_image>
        </Vinyl>
    </Vinyls>
    <DeluxeEditions>
        <DeluxeEdition>
            <Deluxe_album_name numberAlbums="0" numberSongs="0">Deluxe_album_name0</Deluxe_album_name>
            <Deluxe_artist_name autograph="false">Deluxe_artist_name0</Deluxe_artist_name>
            <Deluxe_label_name>Deluxe_label_name0</Deluxe_label_name>
            <Deluxe_release_date>2006-05-04</Deluxe_release_date>
            <Deluxe_price>0</Deluxe_price>
            <Deluxe_image>Deluxe_image0</Deluxe_image>
        </DeluxeEdition>
        <DeluxeEdition>
            <Deluxe_album_name numberAlbums="0" numberSongs="0">Deluxe_album_name1</Deluxe_album_name>
            <Deluxe_artist_name autograph="false">Deluxe_artist_name1</Deluxe_artist_name>
            <Deluxe_label_name>Deluxe_label_name1</Deluxe_label_name>
            <Deluxe_release_date>2006-05-04</Deluxe_release_date>
            <Deluxe_price>0</Deluxe_price>
            <Deluxe_image>Deluxe_image1</Deluxe_image>
        </DeluxeEdition>
    </DeluxeEditions>
    <FanMerchandise>
        <T-shirts>
            <T-shirt>
                <T_shirt_artist_name color="color0" size="0">T_shirt_artist_name0</T_shirt_artist_name>
                <T-shirt_price>0</T-shirt_price>
                <T-shirt_image>T-shirt_image0</T-shirt_image>
            </T-shirt>
            <T-shirt>
                <T_shirt_artist_name color="color1" size="0">T_shirt_artist_name1</T_shirt_artist_name>
                <T-shirt_price>0</T-shirt_price>
                <T-shirt_image>T-shirt_image1</T-shirt_image>
            </T-shirt>
        </T-shirts>
    </FanMerchandise>
</Musicshop>
