<?xml version="1.0" encoding="UTF-8"?>
<Musicshop xmlns:xsi="http://www.w3.org/2001/XMLSchema-instance"
 xsi:noNamespaceSchemaLocation="file:/C:/Users/polic/Desktop/uni/asp/MusicStore/XSD%20schema/MusicStore.xsd">
    <DVDs>
        <DVD>
            <DVD_album_name numberSongs="19">BeerbongsBentleys</DVD_album_name>
            <DVD_artist_name autograph="true">Post Malone</DVD_artist_name>
            <DVD_label_name>Sun</DVD_label_name>
            <DVD_release_date>2018-05-04</DVD_release_date>
            <DVD_price>48</DVD_price>
            <DVD_image>malone.jpg</DVD_image>
        </DVD>
    </DVDs>
    <Vinyls>
        <Vinyl>
            <Vinyl_album_name>Future Nostalgia</Vinyl_album_name>
            <Vinyl_artist_name autograph="false">Dua Lipa</Vinyl_artist_name>
            <Vinyl_label_name>Universal</Vinyl_label_name>
            <Vinyl_release_date>2020-05-04</Vinyl_release_date>
            <Vinyl_price>48</Vinyl_price>
            <Vinyl_image>lipa.jpg</Vinyl_image>
        </Vinyl>
        <Vinyl>
            <Vinyl_album_name numberSongs="18">Meet The Woo 2</Vinyl_album_name>
            <Vinyl_artist_name autograph="true">Pop Smoke</Vinyl_artist_name>
            <Vinyl_label_name>Sun</Vinyl_label_name>
            <Vinyl_release_date>2019-05-04</Vinyl_release_date>
            <Vinyl_price>49</Vinyl_price>
            <Vinyl_image>woo.jpg</Vinyl_image>
        </Vinyl>
    </Vinyls>
</Musicshop>
