<?xml version="1.0" encoding="UTF-8"?>
<Musicshop xmlns:xsi="http://www.w3.org/2001/XMLSchema-instance"
 xsi:noNamespaceSchemaLocation="file:/C:/Users/polic/Desktop/uni/asp/MusicStore/XSD%20schema/MusicStore.xsd">
    <DVDs>
        <DVD>
            <DVD_album_name numberSongs="10">Blame it on Baby</DVD_album_name>
            <DVD_artist_name autograph="true">DaBaby</DVD_artist_name>
            <DVD_label_name>Music Co.</DVD_label_name>
            <DVD_release_date>2020-02-04</DVD_release_date>
            <DVD_price>18</DVD_price>
            <DVD_image>baby.jpg</DVD_image>
        </DVD>
        <DVD>
            <DVD_album_name>Chromatica</DVD_album_name>
            <DVD_artist_name autograph="false">Lady Gaga</DVD_artist_name>
            <DVD_label_name>Sony</DVD_label_name>
            <DVD_release_date>2020-05-04</DVD_release_date>
            <DVD_price>80</DVD_price>
            <DVD_image>gaga.jpg</DVD_image>
        </DVD>
    </DVDs>
    <DeluxeEditions>
        <DeluxeEdition>
            <Deluxe_album_name numberAlbums="2" numberSongs="18">After Hours</Deluxe_album_name>
            <Deluxe_artist_name autograph="false">The Weeknd</Deluxe_artist_name>
            <Deluxe_label_name>Sun</Deluxe_label_name>
            <Deluxe_release_date>2020-05-04</Deluxe_release_date>
            <Deluxe_price>48</Deluxe_price>
            <Deluxe_image>kylie-minogue-kylie-christmas.jpg</Deluxe_image>
        </DeluxeEdition>
    </DeluxeEditions>
    <FanMerchandise>
    </FanMerchandise>
</Musicshop>
