<?xml version="1.0" encoding="UTF-8"?>
<Musicshop xmlns:xsi="http://www.w3.org/2001/XMLSchema-instance"
 xsi:noNamespaceSchemaLocation="file:/C:/Users/polic/Desktop/uni/asp/MusicStore/XSD%20schema/MusicStore.xsd">
    <DVDs>
        <DVD>
            <DVD_album_name>This One's For You Too</DVD_album_name>
            <DVD_artist_name autograph="true">Luke Combs</DVD_artist_name>
            <DVD_label_name>Universal</DVD_label_name>
            <DVD_release_date>2019-05-04</DVD_release_date>
            <DVD_price>47</DVD_price>
            <DVD_image>luke.jpg</DVD_image>
        </DVD>
    </DVDs>
    <Vinyls>
        <Vinyl>
            <Vinyl_album_name numberSongs="10">City On Lock</Vinyl_album_name>
            <Vinyl_artist_name autograph="false">City Girls</Vinyl_artist_name>
            <Vinyl_label_name>Sony</Vinyl_label_name>
            <Vinyl_release_date>2016-05-04</Vinyl_release_date>
            <Vinyl_price>28</Vinyl_price>
            <Vinyl_image>lock.jpg</Vinyl_image>
        </Vinyl>
        <Vinyl>
            <Vinyl_album_name>Eternal Atake</Vinyl_album_name>
            <Vinyl_artist_name autograph="false">Lil Uzi Vert</Vinyl_artist_name>
            <Vinyl_label_name>Sony</Vinyl_label_name>
            <Vinyl_release_date>2018-05-04</Vinyl_release_date>
            <Vinyl_price>28</Vinyl_price>
            <Vinyl_image>atake.jpg</Vinyl_image>
        </Vinyl>
    </Vinyls>
</Musicshop>
