<?xml version="1.0" encoding="UTF-8"?>
<Musicshop xmlns:xsi="http://www.w3.org/2001/XMLSchema-instance"
 xsi:noNamespaceSchemaLocation="file:/C:/Users/polic/Desktop/uni/asp/MusicStore/XSD%20schema/MusicStore.xsd">
    <CDs>
        <CD>
            <CD_album_name>Astroworld</CD_album_name>
            <CD_artist_name autograph="true">Travis Scott</CD_artist_name>
            <CD_label_name>universal</CD_label_name>
            <CD_release_date>2020-05-04</CD_release_date>
            <CD_price>59</CD_price>
            <CD_image>travis.jpg</CD_image>
        </CD>
    </CDs>
    <DVDs>
        <DVD>
            <DVD_album_name numberSongs="30">Pray 4 Love</DVD_album_name>
            <DVD_artist_name autograph="false">Rod Wave</DVD_artist_name>
            <DVD_label_name>Universal</DVD_label_name>
            <DVD_release_date>2019-05-04</DVD_release_date>
            <DVD_price>49</DVD_price>
            <DVD_image>wave.jpg</DVD_image>
        </DVD>
    </DVDs>
    <FanMerchandise>
        <T-shirts>
            <T-shirt>
                <T_shirt_artist_name color="red" size="3">Sam Hunt</T_shirt_artist_name>
                <T-shirt_price>49</T-shirt_price>
                <T-shirt_image>hunt56.jpg</T-shirt_image>
            </T-shirt>
        </T-shirts>
    </FanMerchandise>
</Musicshop>
