<?xml version="1.0" encoding="UTF-8"?>
<Musicshop xmlns:xsi="http://www.w3.org/2001/XMLSchema-instance"
 xsi:noNamespaceSchemaLocation="file:/C:/Users/polic/Desktop/uni/asp/MusicStore/XSD%20schema/MusicStore.xsd">
    <CDs>
        <CD>
            <CD_album_name>The Smartest</CD_album_name>
            <CD_artist_name autograph="true">Tee Grizzley</CD_artist_name>
            <CD_label_name>Sun</CD_label_name>
            <CD_release_date>2019-05-04</CD_release_date>
            <CD_price>26</CD_price>
            <CD_image>grizzley.jpg</CD_image>
        </CD>
    </CDs>
    <DVDs>
        <DVD>
            <DVD_album_name numberSongs="19">If I Know Me</DVD_album_name>
            <DVD_artist_name autograph="false">Morgan Wallen</DVD_artist_name>
            <DVD_label_name>Sony</DVD_label_name>
            <DVD_release_date>2018-05-04</DVD_release_date>
            <DVD_price>19</DVD_price>
            <DVD_image>morgan.jpg</DVD_image>
        </DVD>
    </DVDs>
    <FanMerchandise>
        <T-shirts>
            <T-shirt>
                <T_shirt_artist_name color="green">Megan Thee Stallion</T_shirt_artist_name>
                <T-shirt_price>56</T-shirt_price>
                <T-shirt_image>megan113.jpg</T-shirt_image>
            </T-shirt>
        </T-shirts>
    </FanMerchandise>
</Musicshop>
