<?xml version="1.0" encoding="UTF-8"?>
<Musicshop xmlns:xsi="http://www.w3.org/2001/XMLSchema-instance"
 xsi:noNamespaceSchemaLocation="file:/C:/Users/polic/Desktop/uni/asp/MusicStore/XSD%20schema/MusicStore.xsd">
    <Vinyls>
        <Vinyl>
            <Vinyl_album_name numberSongs="29">Scorpion</Vinyl_album_name>
            <Vinyl_artist_name autograph="true">Drake</Vinyl_artist_name>
            <Vinyl_label_name>Universal</Vinyl_label_name>
            <Vinyl_release_date>2020-05-04</Vinyl_release_date>
            <Vinyl_price>90</Vinyl_price>
            <Vinyl_image>drake23.jpg</Vinyl_image>
        </Vinyl>
    </Vinyls>
    <FanMerchandise>
        <T-shirts>
            <T-shirt>
                <T_shirt_artist_name color="red" size="3">Summer Walker</T_shirt_artist_name>
                <T-shirt_price>48</T-shirt_price>
                <T-shirt_image>walker2435.jpg</T-shirt_image>
            </T-shirt>
            <T-shirt>
                <T_shirt_artist_name color="blue" size="6">Post Malone</T_shirt_artist_name>
                <T-shirt_price>48</T-shirt_price>
                <T-shirt_image>malone243.jpg</T-shirt_image>
            </T-shirt>
        </T-shirts>
    </FanMerchandise>
</Musicshop>
