<?xml version="1.0" encoding="UTF-8"?>
<Musicshop xmlns:xsi="http://www.w3.org/2001/XMLSchema-instance"
 xsi:noNamespaceSchemaLocation="file:/C:/Users/polic/Desktop/uni/asp/MusicStore/XSD%20schema/MusicStore.xsd">
    <CDs>
        <CD>
            <CD_album_name numberSongs="25">Eagles</CD_album_name>
            <CD_artist_name autograph="true">Eagles</CD_artist_name>
            <CD_label_name>Sun</CD_label_name>
            <CD_release_date>2019-05-04</CD_release_date>
            <CD_price>59.30</CD_price>
            <CD_image>eagles.jpg</CD_image>
        </CD>
    </CDs>
    <DeluxeEditions>
        <DeluxeEdition>
            <Deluxe_album_name numberAlbums="2">Hot Pink</Deluxe_album_name>
            <Deluxe_artist_name autograph="true">Doja Cat</Deluxe_artist_name>
            <Deluxe_label_name>Sony</Deluxe_label_name>
            <Deluxe_release_date>2019-05-04</Deluxe_release_date>
            <Deluxe_price>59</Deluxe_price>
            <Deluxe_image>doja.jpg</Deluxe_image>
        </DeluxeEdition>
        <DeluxeEdition>
            <Deluxe_album_name numberSongs="19">Changes</Deluxe_album_name>
            <Deluxe_artist_name autograph="true">Justin Bieber</Deluxe_artist_name>
            <Deluxe_label_name>Universal</Deluxe_label_name>
            <Deluxe_release_date>2019-05-04</Deluxe_release_date>
            <Deluxe_price>47</Deluxe_price>
            <Deluxe_image>bieber.jpg</Deluxe_image>
        </DeluxeEdition>
    </DeluxeEditions>
</Musicshop>
